{
  "$schema": "./test-case.schema.json",
  "source": {
    "api": "Medusa Store API",
    "version": "2.21.2",
    "openApi": "https://raw.githubusercontent.com/medusajs/medusa/6ac9524c/www/apps/api-reference/specs/store/openapi.full.yaml"
  },
  "domain": "Regions",
  "generated": true,
  "caseCount": 40,
  "cases": [
    {
      "id": "MED-STORE-REGIONS-001",
      "title": "List regions: default pagination",
      "domain": "Regions",
      "category": "filtering-pagination-sorting",
      "priority": "medium",
      "source": {
        "apiVersion": "2.21.2",
        "method": "GET",
        "path": "/store/regions"
      },
      "auth": {
        "publishableApiKey": true,
        "customerAuthentication": false
      },
      "preconditions": [],
      "request": {
        "method": "GET",
        "path": "/store/regions",
        "headers": [
          {
            "name": "x-publishable-api-key",
            "value": "${MEDUSA_PUBLISHABLE_API_KEY}"
          }
        ],
        "variation": "Omit limit and offset"
      },
      "expected": {
        "status": 200,
        "assertions": [
          "HTTP status matches 200",
          "StoreRegionListResponse"
        ]
      },
      "automation": {
        "status": "candidate",
        "notes": "Generated from the v2.21.2 Store API contract and a risk-based matrix. Refine concrete fixtures and payload values before automation."
      }
    },
    {
      "id": "MED-STORE-REGIONS-002",
      "title": "Retrieve a region: limit one",
      "domain": "Regions",
      "category": "filtering-pagination-sorting",
      "priority": "medium",
      "source": {
        "apiVersion": "2.21.2",
        "method": "GET",
        "path": "/store/regions/{id}"
      },
      "auth": {
        "publishableApiKey": true,
        "customerAuthentication": false
      },
      "preconditions": [
        "A configured region exists"
      ],
      "request": {
        "method": "GET",
        "path": "/store/regions/{id}",
        "headers": [
          {
            "name": "x-publishable-api-key",
            "value": "${MEDUSA_PUBLISHABLE_API_KEY}"
          }
        ],
        "variation": "Set limit=1"
      },
      "expected": {
        "status": 200,
        "assertions": [
          "HTTP status matches 200",
          "StoreRegionResponse"
        ]
      },
      "automation": {
        "status": "candidate",
        "notes": "Generated from the v2.21.2 Store API contract and a risk-based matrix. Refine concrete fixtures and payload values before automation."
      }
    },
    {
      "id": "MED-STORE-REGIONS-003",
      "title": "List regions: negative limit",
      "domain": "Regions",
      "category": "filtering-pagination-sorting",
      "priority": "medium",
      "source": {
        "apiVersion": "2.21.2",
        "method": "GET",
        "path": "/store/regions"
      },
      "auth": {
        "publishableApiKey": true,
        "customerAuthentication": false
      },
      "preconditions": [],
      "request": {
        "method": "GET",
        "path": "/store/regions",
        "headers": [
          {
            "name": "x-publishable-api-key",
            "value": "${MEDUSA_PUBLISHABLE_API_KEY}"
          }
        ],
        "variation": "Set limit=-1"
      },
      "expected": {
        "status": [
          400,
          422
        ],
        "assertions": [
          "HTTP status matches 400 or 422"
        ]
      },
      "automation": {
        "status": "candidate",
        "notes": "Generated from the v2.21.2 Store API contract and a risk-based matrix. Refine concrete fixtures and payload values before automation."
      }
    },
    {
      "id": "MED-STORE-REGIONS-004",
      "title": "Retrieve a region: large offset",
      "domain": "Regions",
      "category": "filtering-pagination-sorting",
      "priority": "medium",
      "source": {
        "apiVersion": "2.21.2",
        "method": "GET",
        "path": "/store/regions/{id}"
      },
      "auth": {
        "publishableApiKey": true,
        "customerAuthentication": false
      },
      "preconditions": [
        "A configured region exists"
      ],
      "request": {
        "method": "GET",
        "path": "/store/regions/{id}",
        "headers": [
          {
            "name": "x-publishable-api-key",
            "value": "${MEDUSA_PUBLISHABLE_API_KEY}"
          }
        ],
        "variation": "Set offset beyond available regions"
      },
      "expected": {
        "status": 200,
        "assertions": [
          "HTTP status matches 200",
          "StoreRegionResponse"
        ]
      },
      "automation": {
        "status": "candidate",
        "notes": "Generated from the v2.21.2 Store API contract and a risk-based matrix. Refine concrete fixtures and payload values before automation."
      }
    },
    {
      "id": "MED-STORE-REGIONS-005",
      "title": "List regions: filter by ID",
      "domain": "Regions",
      "category": "filtering-pagination-sorting",
      "priority": "medium",
      "source": {
        "apiVersion": "2.21.2",
        "method": "GET",
        "path": "/store/regions"
      },
      "auth": {
        "publishableApiKey": true,
        "customerAuthentication": false
      },
      "preconditions": [],
      "request": {
        "method": "GET",
        "path": "/store/regions",
        "headers": [
          {
            "name": "x-publishable-api-key",
            "value": "${MEDUSA_PUBLISHABLE_API_KEY}"
          }
        ],
        "variation": "Filter using an existing region ID"
      },
      "expected": {
        "status": 200,
        "assertions": [
          "HTTP status matches 200",
          "StoreRegionListResponse"
        ]
      },
      "automation": {
        "status": "candidate",
        "notes": "Generated from the v2.21.2 Store API contract and a risk-based matrix. Refine concrete fixtures and payload values before automation."
      }
    },
    {
      "id": "MED-STORE-REGIONS-006",
      "title": "Retrieve a region: ascending name order",
      "domain": "Regions",
      "category": "filtering-pagination-sorting",
      "priority": "medium",
      "source": {
        "apiVersion": "2.21.2",
        "method": "GET",
        "path": "/store/regions/{id}"
      },
      "auth": {
        "publishableApiKey": true,
        "customerAuthentication": false
      },
      "preconditions": [
        "A configured region exists"
      ],
      "request": {
        "method": "GET",
        "path": "/store/regions/{id}",
        "headers": [
          {
            "name": "x-publishable-api-key",
            "value": "${MEDUSA_PUBLISHABLE_API_KEY}"
          }
        ],
        "variation": "Request ascending name order"
      },
      "expected": {
        "status": 200,
        "assertions": [
          "HTTP status matches 200",
          "StoreRegionResponse"
        ]
      },
      "automation": {
        "status": "candidate",
        "notes": "Generated from the v2.21.2 Store API contract and a risk-based matrix. Refine concrete fixtures and payload values before automation."
      }
    },
    {
      "id": "MED-STORE-REGIONS-007",
      "title": "List regions: default pagination",
      "domain": "Regions",
      "category": "filtering-pagination-sorting",
      "priority": "medium",
      "source": {
        "apiVersion": "2.21.2",
        "method": "GET",
        "path": "/store/regions"
      },
      "auth": {
        "publishableApiKey": true,
        "customerAuthentication": false
      },
      "preconditions": [],
      "request": {
        "method": "GET",
        "path": "/store/regions",
        "headers": [
          {
            "name": "x-publishable-api-key",
            "value": "${MEDUSA_PUBLISHABLE_API_KEY}"
          }
        ],
        "variation": "Omit limit and offset"
      },
      "expected": {
        "status": 200,
        "assertions": [
          "HTTP status matches 200",
          "StoreRegionListResponse"
        ]
      },
      "automation": {
        "status": "candidate",
        "notes": "Generated from the v2.21.2 Store API contract and a risk-based matrix. Refine concrete fixtures and payload values before automation."
      }
    },
    {
      "id": "MED-STORE-REGIONS-008",
      "title": "Retrieve a region: limit one",
      "domain": "Regions",
      "category": "filtering-pagination-sorting",
      "priority": "medium",
      "source": {
        "apiVersion": "2.21.2",
        "method": "GET",
        "path": "/store/regions/{id}"
      },
      "auth": {
        "publishableApiKey": true,
        "customerAuthentication": false
      },
      "preconditions": [
        "A configured region exists"
      ],
      "request": {
        "method": "GET",
        "path": "/store/regions/{id}",
        "headers": [
          {
            "name": "x-publishable-api-key",
            "value": "${MEDUSA_PUBLISHABLE_API_KEY}"
          }
        ],
        "variation": "Set limit=1"
      },
      "expected": {
        "status": 200,
        "assertions": [
          "HTTP status matches 200",
          "StoreRegionResponse"
        ]
      },
      "automation": {
        "status": "candidate",
        "notes": "Generated from the v2.21.2 Store API contract and a risk-based matrix. Refine concrete fixtures and payload values before automation."
      }
    },
    {
      "id": "MED-STORE-REGIONS-009",
      "title": "List regions: negative limit",
      "domain": "Regions",
      "category": "filtering-pagination-sorting",
      "priority": "medium",
      "source": {
        "apiVersion": "2.21.2",
        "method": "GET",
        "path": "/store/regions"
      },
      "auth": {
        "publishableApiKey": true,
        "customerAuthentication": false
      },
      "preconditions": [],
      "request": {
        "method": "GET",
        "path": "/store/regions",
        "headers": [
          {
            "name": "x-publishable-api-key",